{
  "generated_at": "2026-03-31",
  "workspace_root": "/Users/bentaylor/Code/how_to_code_rust",
  "validation_order": [
    "cargo check -p <arc>",
    "cargo nextest run -E 'package(<arc>)'",
    "cargo test -p <arc> --doc",
    "cargo nextest run -E 'rdeps(<arc>)' --ignore-default-filter",
    "cargo test -p contract-tests",
    "cargo test -p e2e-smoke"
  ],
  "shared_contracts": [
    "Public crates must ship doctest coverage or an explicit AER.",
    "Reverse dependency validation is required when a public surface, feature graph, or schema boundary changes.",
    "Mutation and semver checks belong in scheduled hardening, not the inner loop."
  ],
  "ci_profiles": [
    {
      "name": "inner-loop",
      "commands": [
        "cargo check --workspace",
        "cargo nextest run -E 'default()'",
        "cargo test --workspace --doc"
      ]
    },
    {
      "name": "pull-request",
      "commands": [
        "cargo vrc plan --changed .",
        "cargo aer scan",
        "cargo bench -p arc-bench -- --scenario repo-shape"
      ]
    },
    {
      "name": "scheduled-hardening",
      "commands": [
        "cargo mutants -p cargo-vrc",
        "cargo hack check --workspace --feature-powerset",
        "cargo semver-checks check-release"
      ]
    }
  ],
  "instruction_roots": [
    "AGENTS.md",
    "CLAUDE.md",
    ".github/copilot-instructions.md",
    ".github/instructions"
  ],
  "members": [
    {
      "name": "arc-bench",
      "manifest_path": "crates/arc-bench/Cargo.toml",
      "package_root": "crates/arc-bench",
      "direct_dependencies": [
        "cargo-aer",
        "cargo-vrc"
      ],
      "reverse_dependencies": [],
      "public_surfaces": [
        "repo_shape_benchmark",
        "runtime_benchmark",
        "exception_benchmark",
        "report_command"
      ],
      "risk_tags": [
        "risk:medium",
        "has-aer"
      ],
      "instruction_locations": [
        "AGENTS.md",
        "CLAUDE.md",
        ".github/copilot-instructions.md",
        "crates/arc-bench/AGENTS.md"
      ],
      "validation_commands": {
        "local": [
          "cargo check -p arc-bench",
          "cargo test -p arc-bench"
        ],
        "boundary": []
      },
      "api_surface_hash": "57ba9ff8c38cb689045d909bb3081ca407a7239d4fb233a339021f761de61be0",
      "proof_density": 1.25,
      "context_roots": [
        ".github/copilot-instructions.md",
        "AGENTS.md",
        "CLAUDE.md",
        "crates/arc-bench",
        "crates/arc-bench/AGENTS.md",
        "crates/arc-bench/src"
      ],
      "exception_refs": [
        "mega-function.runtime_actor_loop"
      ]
    },
    {
      "name": "cargo-aer",
      "manifest_path": "crates/cargo-aer/Cargo.toml",
      "package_root": "crates/cargo-aer",
      "direct_dependencies": [
        "cargo-vrc"
      ],
      "reverse_dependencies": [
        "arc-bench"
      ],
      "public_surfaces": [
        "scan_command",
        "report_command",
        "stale_command",
        "init_command"
      ],
      "risk_tags": [
        "risk:medium",
        "public-api",
        "has-aer"
      ],
      "instruction_locations": [
        "AGENTS.md",
        "CLAUDE.md",
        ".github/copilot-instructions.md",
        "crates/cargo-aer/AGENTS.md"
      ],
      "validation_commands": {
        "local": [
          "cargo check -p cargo-aer",
          "cargo test -p cargo-aer",
          "cargo test -p cargo-aer --doc"
        ],
        "boundary": [
          "cargo nextest run -E 'rdeps(cargo-aer)' --ignore-default-filter"
        ]
      },
      "api_surface_hash": "3dbbca1a476454e232d9ca30408e273b3c6599639b9c2ecfb225fc5c52aae8bf",
      "proof_density": 2.0,
      "context_roots": [
        ".github/copilot-instructions.md",
        "AGENTS.md",
        "CLAUDE.md",
        "crates/cargo-aer",
        "crates/cargo-aer/AGENTS.md",
        "crates/cargo-aer/src"
      ],
      "exception_refs": [
        "mega-file.scanner-module",
        "mega-function.scanner-core"
      ]
    },
    {
      "name": "cargo-vrc",
      "manifest_path": "crates/cargo-vrc/Cargo.toml",
      "package_root": "crates/cargo-vrc",
      "direct_dependencies": [],
      "reverse_dependencies": [
        "arc-bench",
        "cargo-aer"
      ],
      "public_surfaces": [
        "map_command",
        "plan_command",
        "explain_command",
        "verify_command"
      ],
      "risk_tags": [
        "risk:medium",
        "public-api",
        "has-aer"
      ],
      "instruction_locations": [
        "AGENTS.md",
        "CLAUDE.md",
        ".github/copilot-instructions.md",
        "crates/cargo-vrc/AGENTS.md"
      ],
      "validation_commands": {
        "local": [
          "cargo check -p cargo-vrc",
          "cargo test -p cargo-vrc",
          "cargo test -p cargo-vrc --doc"
        ],
        "boundary": [
          "cargo nextest run -E 'rdeps(cargo-vrc)' --ignore-default-filter"
        ]
      },
      "api_surface_hash": "eed8546e405fa198e44fc5e36119ab6e69e1728754ddb36a568dace9d7c3e98f",
      "proof_density": 2.0,
      "context_roots": [
        ".github/copilot-instructions.md",
        "AGENTS.md",
        "CLAUDE.md",
        "crates/cargo-vrc",
        "crates/cargo-vrc/AGENTS.md",
        "crates/cargo-vrc/src"
      ],
      "exception_refs": [
        "mega-file.planner-module",
        "mega-function.vrc-plan"
      ]
    },
    {
      "name": "paper-sync",
      "manifest_path": "tools/paper-sync/Cargo.toml",
      "package_root": "tools/paper-sync",
      "direct_dependencies": [],
      "reverse_dependencies": [],
      "public_surfaces": [
        "check_command",
        "index_command"
      ],
      "risk_tags": [
        "risk:low",
        "has-aer"
      ],
      "instruction_locations": [
        "AGENTS.md",
        "CLAUDE.md",
        ".github/copilot-instructions.md",
        "tools/paper-sync/AGENTS.md"
      ],
      "validation_commands": {
        "local": [
          "cargo check -p paper-sync",
          "cargo test -p paper-sync"
        ],
        "boundary": []
      },
      "api_surface_hash": "eb26018c15b52f4a59aa616cc9b767613a5a8991f927333f373a7ed8a571dcf9",
      "proof_density": 2.5,
      "context_roots": [
        ".github/copilot-instructions.md",
        "AGENTS.md",
        "CLAUDE.md",
        "tools/paper-sync",
        "tools/paper-sync/AGENTS.md",
        "tools/paper-sync/src"
      ],
      "exception_refs": [
        "mega-function.sync-run"
      ]
    }
  ]
}